{"proposal_id":"0a1b2c3d-0000-4000-8000-000000000010","state":"proposed","tenant_id":"5325ffe9-5727-4d88-9832-aebabb8d0538","agent_id":"liam-alpha","key_id":"0a1b2c3d-0000-4000-8000-000000000001","on_behalf_of":"user:oscar","purpose":"servicing","key_expires_at":"2026-12-31T00:00:00+00:00","nono_session_id":null,"run_id":"run-1","action_type":"crm.case_note@1","party_ref":"party://p1","parameters":{"case_ref":"payload://c1"},"justification":"j","trace_ref":"trace://t1","created_at":"2026-10-22T12:00:00+00:00","expires_at":"2026-10-22T20:00:00+00:00"}
